{
  "schemaVersion": 1,
  "kind": "engineering-process-improvement-signal",
  "signalId": "windows-helper-protocol-signal",
  "createdAt": "2026-08-24T00:00:00Z",
  "source": {
    "project": "sample-consumer",
    "repository": "example/sample-consumer",
    "checkpoint": "1111111111111111111111111111111111111111",
    "workspaceFingerprint": "sha256:2222222222222222222222222222222222222222222222222222222222222222",
    "process": {
      "version": "0.4.0",
      "digest": "sha256:3333333333333333333333333333333333333333333333333333333333333333"
    },
    "changeId": "sample-change",
    "cycle": 1
  },
  "target": {
    "project": "engineering-process",
    "repository": "example/engineering-process"
  },
  "trigger": {
    "kind": "verification-failure",
    "status": "failed"
  },
  "claim": {
    "ownerBoundary": "shared-process",
    "reusableClass": "deterministic-enforcement",
    "proposedInvariantId": "single-windows-helper-protocol",
    "rationaleSha256": "sha256:4444444444444444444444444444444444444444444444444444444444444444",
    "affectedSurfaces": [
      "command-execution",
      "windows-supervision"
    ]
  },
  "evidence": {
    "kind": "supplemental-verification",
    "artifactSha256": "sha256:5555555555555555555555555555555555555555555555555555555555555555",
    "artifactBytes": 4096,
    "commandSha256": "sha256:6666666666666666666666666666666666666666666666666666666666666666",
    "diagnosticSha256": "sha256:7777777777777777777777777777777777777777777777777777777777777777",
    "reference": "https://example.invalid/runs/123"
  },
  "controls": {
    "rawOutputIncluded": false,
    "environmentIncluded": false,
    "secretsIncluded": false,
    "grantsAuthority": false
  }
}
